{
  "$schema": "https://helios.zero/schemas/domains/planet.schema.json",
  "schema_version": "1.0",
  "id": "planet/earth",
  "type": "planet",
  "identity": {
    "name": "Earth",
    "designations": ["Terra", "Sol III", "Gaia"],
    "classification": {
      "primary": "planet",
      "subtype": "terrestrial"
    }
  },
  "status": "confirmed",
  "relationships": {
    "parent": "star/sol",
    "children": ["moon/luna"]
  },
  "discovery": {
    "date": "prehistoric",
    "method": "visual"
  },
  "measurements": {
    "position": {
      "frame": "ICRS",
      "epoch": "J2000.0",
      "distance": {
        "value": 1,
        "unit": "AU",
        "source": "iau-2015"
      }
    },
    "mass": {
      "value": 1,
      "unit": "M_earth",
      "source": "iau-2015"
    },
    "radius": {
      "value": 1,
      "unit": "R_earth",
      "source": "iau-2015"
    },
    "rotation": {
      "period": {
        "value": 23.934,
        "unit": "hr",
        "uncertainty": 0.001,
        "source": "iau-2015"
      },
      "axis_tilt": {
        "value": 23.44,
        "unit": "deg",
        "source": "iau-2015"
      },
      "direction": "prograde"
    },
    "density": {
      "value": 5.51,
      "unit": "g/cm^3",
      "source": "iau-2015"
    },
    "photometry": {
      "apparent": {
        "V": {
          "value": -3.99,
          "unit": "mag",
          "source": "helios-derived"
        }
      }
    }
  },
  "components": {
    "orbit": {
      "type": "orbit",
      "orbit": {
        "type": "keplerian",
        "primary": "star/sol",
        "semi_major_axis": {
          "value": 1,
          "unit": "AU",
          "source": "iau-2015"
        },
        "eccentricity": 0.0167,
        "inclination": {
          "value": 0.0,
          "unit": "deg",
          "source": "iau-2015"
        },
        "period": {
          "value": 365.256,
          "unit": "day",
          "source": "iau-2015"
        }
      }
    },
    "atmosphere": {
      "type": "atmosphere",
      "composition": {
        "N2": { "fraction": 0.7808 },
        "O2": { "fraction": 0.2095 },
        "Ar": { "fraction": 0.0093 },
        "CO2": { "fraction": 0.0004 }
      },
      "surface_pressure": {
        "value": 101325,
        "unit": "Pa"
      }
    },
    "terrain": {
      "type": "terrain",
      "type_classification": "terrestrial_rocky"
    },
    "ocean": {
      "type": "ocean"
    }
  },
  "visual": {
    "render": {
      "model": "sphere",
      "surface": {
        "material": "terrain"
      },
      "color": {
        "mode": "textured",
        "value": "blue"
      },
      "scale": {
        "mode": "physical"
      }
    }
  },
  "sources": {
    "iau-2015": {
      "type": "resolution",
      "citation": "IAU 2015 Resolution B3: Recommended Nominal Conversion Constants",
      "accessed": "2026-09-09"
    }
  }
}
