{
  "$schema": "https://helios.zero/schemas/domains/star.schema.json",
  "schema_version": "1.0",
  "id": "star/sol",
  "type": "star",
  "identity": {
    "name": "Sol",
    "designations": [
      "Sun",
      "G2V",
      "HIP 0"
    ],
    "classification": {
      "primary": "star",
      "subtype": "yellow_dwarf",
      "spectral_type": "G2V"
    }
  },
  "status": "confirmed",
  "relationships": {
    "parent": "system/solar-system",
    "children": [
      "planet/mercury",
      "planet/venus",
      "planet/earth",
      "planet/mars"
    ]
  },
  "measurements": {
    "radius": {
      "value": 1,
      "unit": "R_sun",
      "source": "iau-2015"
    },
    "mass": {
      "value": 1,
      "unit": "M_sun",
      "source": "iau-2015"
    },
    "effective_temperature": {
      "value": 5772,
      "unit": "K",
      "source": "iau-2015"
    }
  },
  "derived": {
    "luminosity": {
      "value": 1,
      "unit": "L_sun",
      "method": "nominal",
      "source": "iau-2015"
    }
  },
  "components": {
    "light_source": {
      "type": "light_source",
      "luminosity": {
        "value": 1,
        "unit": "L_sun",
        "source": "iau-2015"
      },
      "effective_temperature": {
        "value": 5772,
        "unit": "K",
        "source": "iau-2015"
      },
      "spectrum": {
        "type": "blackbody"
      }
    }
  },
  "visual": {
    "render": {
      "model": "star",
      "surface": {
        "material": "stellar"
      },
      "color": {
        "mode": "blackbody"
      },
      "scale": {
        "mode": "physical"
      }
    }
  },
  "sources": {
    "iau-2015": {
      "type": "resolution",
      "citation": "IAU 2015 Resolution B3: Recommended Nominal Conversion Constants",
      "accessed": "2026-09-09"
    }
  }
}
