{
  "$schema": "https://helios.zero/schemas/domains/planet.schema.json",
  "schema_version": "1.0",
  "id": "planet/mercury",
  "type": "planet",
  "identity": {
    "name": "Mercury",
    "designations": ["Sol I"],
    "classification": {
      "primary": "planet",
      "subtype": "terrestrial"
    }
  },
  "status": "confirmed",
  "relationships": {
    "parent": "star/sol"
  },
  "discovery": { "date": "prehistoric", "method": "visual" },
  "measurements": {
    "mass": { "value": 0.055, "unit": "M_earth", "source": "iau-2015" },
    "radius": { "value": 0.383, "unit": "R_earth", "source": "iau-2015" }
  },
  "components": {
    "orbit": {
      "type": "orbit",
      "orbit": {
        "type": "keplerian",
        "primary": "star/sol",
        "semi_major_axis": { "value": 0.387, "unit": "AU", "source": "iau-2015" },
        "eccentricity": 0.2056,
        "period": { "value": 87.97, "unit": "day", "source": "iau-2015" }
      }
    },
    "terrain": { "type": "terrain", "type_classification": "rocky_cratered" }
  },
  "visual": {
    "render": { "model": "sphere", "color": { "mode": "textured", "value": "gray" }, "scale": { "mode": "physical" } }
  },
  "sources": {
    "iau-2015": { "type": "resolution", "citation": "IAU 2015 Resolution B3", "accessed": "2026-09-09" }
  }
}
