{
  "$schema": "https://helios.zero/schemas/domains/star.schema.json",
  "schema_version": "1.0",
  "id": "star/alpha-centauri-a",
  "type": "star",
  "identity": {
    "name": "Alpha Centauri A",
    "designations": ["Rigil Kentaurus A", "GJ 559 A", "HIP 71683"],
    "classification": { "primary": "star", "subtype": "yellow_dwarf", "spectral_type": "G2V" }
  },
  "status": "confirmed",
  "relationships": {
    "parent": "system/alpha-centauri",
    "companions": ["star/alpha-centauri-b", "star/proxima-centauri"]
  },
  "discovery": { "date": "prehistoric", "method": "visual" },
  "measurements": {
    "mass": { "value": 1.1055, "unit": "M_sun", "uncertainty": 0.0039, "source": "kervella-2017" },
    "radius": { "value": 1.2234, "unit": "R_sun", "uncertainty": 0.0053, "source": "kervella-2017" },
    "effective_temperature": { "value": 5790, "unit": "K", "source": "kervella-2017" }
  },
  "components": {
    "light_source": {
      "type": "light_source",
      "luminosity": { "value": 1.519, "unit": "L_sun", "source": "kervella-2017" },
      "effective_temperature": { "value": 5790, "unit": "K", "source": "kervella-2017" },
      "spectrum": { "type": "blackbody" }
    },
    "orbit": {
      "type": "orbit",
      "orbit": {
        "type": "keplerian",
        "primary": "system/alpha-centauri",
        "semi_major_axis": { "value": 23.7, "unit": "AU", "source": "kervella-2017" },
        "eccentricity": 0.517,
        "period": { "value": 79.91, "unit": "yr", "source": "kervella-2017" }
      }
    }
  },
  "visual": {
    "render": { "model": "star", "color": { "mode": "blackbody" }, "scale": { "mode": "physical" } }
  },
  "sources": {
    "kervella-2017": { "type": "paper", "citation": "Kervella et al. (2017), A&A 598, L7", "doi": "10.1051/0004-6361/201629985", "accessed": "2026-09-09" }
  }
}
